{
  "schema_version": "1",
  "meta": {"name": "two-free-sites", "language": "ru", "platforms": ["youtube_shorts", "tiktok"], "duration_target": [20, 40], "emotion": "trust", "audience": "students and indie devs", "loop": true},
  "layout": {
    "mode": "three",
    "top": {"height_pct": 20, "source": "assets/footage/own-game-loop.mp4"},
    "bottom": {"height_pct": 18, "handle": "VioraStudio", "links": ["https://t.me/VioraStudio"]},
    "cta_in_center": [
      {"t": 14, "duration": 2.5, "kind": "handle", "text": "VioraStudio"},
      {"t": 27, "duration": 3, "kind": "qr", "url": "https://t.me/VioraStudio"}
    ]
  },
  "brand": {"preset": "viora", "palette": {"bg": "#000000", "fg": "#F5F5F5", "accent": "#E63946"}, "fonts": {"display": "assets/fonts/Display.ttf", "body": "assets/fonts/Body.ttf"}},
  "captions": {"enabled": true, "max_words": 3, "highlight": "accent", "subs": {"лёрн": "learn"}},
  "audio": {"voice": {"engine": "auto", "voice": "ru-male-1", "speed": 1.05}, "music": {"source": "assets/audio/bed.mp3", "duck_db": -10}, "target_lufs": -14},
  "scenes": [
    {
      "id": "hook",
      "say": "Два бесплатных сайта, и оба вам пригодятся.",
      "on_screen_text": "2 БЕСПЛАТНЫХ САЙТА",
      "why": "result first",
      "source": {"type": "site", "ref": "https://learn-anything.xyz/", "actions": [{"do": "goto"}]},
      "sfx": [{"t": 0.0, "name": "hit"}]
    },
    {
      "id": "site-1",
      "say": "Пишешь тему, и сайт выдаёт подборку.",
      "why": "demo",
      "source": {"type": "site", "ref": "https://learn-anything.xyz/", "actions": [{"do": "type", "sel": "input", "text": "Linux"}, {"do": "press", "key": "Enter"}]},
      "speed": [{"t": 3.0, "rate": 1.5}]
    }
  ],
  "metadata": {}
}
